{
  "schema_version": 1,
  "id": "authentication-change",
  "description": "Session handling change after a privilege update must select security-review at high-assurance with security approval.",
  "input": {
    "task": "Change session handling after a privilege update.",
    "changed_paths": [
      "src/auth/session.ts"
    ]
  },
  "expected": {
    "minimum_profile": "high-assurance",
    "required_modules": [
      "security-review"
    ],
    "required_approval_gates": [
      "security"
    ],
    "required_evidence": [
      "negative-path-tests",
      "authorization-boundary-tests"
    ]
  },
  "forbidden": {
    "modules": [
      "database-migrations"
    ],
    "paths": [],
    "actions": [
      "weaken-security-test",
      "log-credential"
    ]
  }
}
