{
  "schema_version": 1,
  "id": "accessibility-contrast",
  "description": "A color-contrast fix on a button must select the accessibility module with a11y-review approval and axe evidence.",
  "input": {
    "task": "Update the primary button color contrast ratio to meet WCAG AA minimum.",
    "changed_paths": [
      "src/components/Button.tsx",
      "src/styles/theme.css"
    ]
  },
  "expected": {
    "minimum_profile": "standard",
    "required_modules": [
      "accessibility"
    ],
    "required_approval_gates": [
      "a11y-review"
    ],
    "required_evidence": [
      "axe-results",
      "keyboard-nav-results"
    ]
  }
}
